{
  "schemaVersion": 2,
  "source": {
    "kind": "other",
    "description": "FortKnight's empty example — replace it with the import document your assistant wrote from your calendar, planner or task list (docs/importers.md)"
  },
  "commitments": [],
  "tasks": [],
  "skipped": [],
  "review": [
    "This is the shape, not your schedule: `commitments` are timed things (appointments, lessons, work or school hours), `tasks` have a day but no clock time, `skipped` is what your assistant saw and left out (and why), `review` is its summary so you can check the list is complete.",
    "Ask your assistant for yours, paste or upload it here, then Apply."
  ],
  "notes": [
    "Generated by scripts/build.py from the neutral canonical data."
  ]
}
