{
  "schemaVersion": 2,
  "source": {
    "kind": "google-calendar",
    "description": "Sample: a Google Calendar read for events 2026-08-01 → 2026-11-30, exported 2026-08-16",
    "importedAt": "2026-08-16"
  },
  "commitments": [
    {"title": "Piano lesson", "repeats": "every week", "weekdays": ["friday"], "start": "2:00 PM", "lasts": "2 h 15 min", "category": "spirituality-development", "from": "'Piano w/ Ms. Ito' — 12 occurrences seen"},
    {"title": "Choir", "repeats": "every other week from 2026-09-02", "weekdays": ["Wed"], "start": "6:30 PM", "lasts": "1 h 30 min", "category": "Spirituality & Development"},
    {"title": "Book club", "repeats": "monthly on the 2nd tuesday", "start": "7:00 PM", "lasts": "2 h", "category": "friends-family"},
    {"title": "Rent", "repeats": "monthly on day 1", "start": "9:00 AM", "lasts": "15 min", "category": "operations"},
    {"title": "Dentist", "repeats": "once on 2026-10-14", "start": "9:30 AM", "lasts": "1 h", "category": "health", "from": "one-off event; the reminder said 'bring insurance card'"}
  ],
  "tasks": [
    {"title": "Take out the bins", "repeats": "every week", "weekdays": ["tuesday"], "when": "evening", "lasts": "10 min", "category": "cleaning"},
    {"title": "Water the plants", "repeats": "every week", "weekdays": ["saturday", "wednesday"], "when": "anytime", "category": "operations"}
  ],
  "skipped": [
    {"title": "Mom's birthday", "why": "all-day event with no time — a day note, not a commitment"},
    {"title": "Yoga (cancelled series)", "why": "every occurrence after 2026-07-01 was cancelled"}
  ],
  "review": [
    "14 recurring events and 3 one-offs found between 2026-08-01 and 2026-11-30; 5 imported as commitments, 2 as tasks, 2 skipped (listed).",
    "Guessed: 'Book club' has no end time in the calendar — 2 h assumed."
  ],
  "notes": ["Sample version-2 import document for tests and docs."]
}
