{
  "schemaVersion": 1,
  "source": {
    "kind": "photo",
    "description": "Kitchen whiteboard, photographed 2026-08-15",
    "importedAt": "2026-08-15"
  },
  "standingAppointments": [
    {
      "title": "Piano lesson",
      "weekdays": [
        "friday"
      ],
      "start": "14:00",
      "durationMinutes": 135,
      "category": "spirituality-development",
      "cadence": {
        "kind": "weekly"
      }
    }
  ],
  "notes": [
    "Sample import document for tests and docs."
  ],
  "fixedActivities": [
    {
      "id": "choir-practice--wed-a--late",
      "title": "Choir practice",
      "dayKey": "wed-a",
      "block": "late",
      "priority": 1,
      "categories": [
        "spirituality-development"
      ],
      "flexibility": "no",
      "timing": {
        "estimatedStart": "18:30",
        "estimatedEnd": "20:00",
        "durationMinutes": 90
      }
    }
  ],
  "meals": [
    {
      "slot": "dinner",
      "days": [
        "wed-a"
      ],
      "menu": "Lentil soup",
      "cookExtra": false
    },
    {
      "slot": "brunch",
      "dayKey": "fri-b",
      "menu": "Pancakes"
    }
  ],
  "blocks": [
    {
      "key": "unscheduled",
      "start": "22:00",
      "end": "06:00",
      "durationMinutes": 480,
      "carriesFocus": false
    },
    {
      "key": "early",
      "start": "06:00",
      "end": "14:00",
      "durationMinutes": 480,
      "carriesFocus": true
    },
    {
      "key": "late",
      "start": "14:00",
      "end": "22:00",
      "durationMinutes": 480,
      "carriesFocus": true
    }
  ],
  "blockFocusGrid": {
    "sun-a": {
      "early": "meals",
      "late": "cleaning"
    },
    "wed-a": {
      "early": "working",
      "late": "spirituality-development"
    }
  },
  "appointmentBlocks": {
    "wed-a": "late"
  }
}
